{
  "hotspot": {
    "locality_id": "L23860501",
    "name": "Licht Park",
    "coordinates": {
      "latitude": 42.5152064,
      "longitude": -83.0134349
    }
  },
  "effort": {
    "total_complete_checklists": 2,
    "total_species_detected": 0,
    "monthly_checklists": {
      "1": 0,
      "2": 0,
      "3": 0,
      "4": 1,
      "5": 1,
      "6": 0,
      "7": 0,
      "8": 0,
      "9": 0,
      "10": 0,
      "11": 0,
      "12": 0
    }
  },
  "species": [],
  "metadata": {
    "generated_at": "2026-03-26T23:30:05.303857Z",
    "data_version": "Dec-2025"
  }
}