{
  "hotspot": {
    "locality_id": "L54524669",
    "name": "Gladwin SF--E Ridge Road",
    "coordinates": {
      "latitude": 44.0156225,
      "longitude": -84.2795301
    }
  },
  "effort": {
    "total_complete_checklists": 4,
    "total_species_detected": 0,
    "monthly_checklists": {
      "1": 0,
      "2": 2,
      "3": 0,
      "4": 0,
      "5": 0,
      "6": 0,
      "7": 0,
      "8": 0,
      "9": 0,
      "10": 0,
      "11": 0,
      "12": 2
    }
  },
  "species": [],
  "metadata": {
    "generated_at": "2026-03-24T01:04:53.753244Z",
    "data_version": "Dec-2025"
  }
}