{
  "hotspot": {
    "locality_id": "L16664959",
    "name": "Oxbow Lake",
    "coordinates": {
      "latitude": 42.646427,
      "longitude": -83.480701
    }
  },
  "effort": {
    "total_complete_checklists": 7,
    "total_species_detected": 0,
    "monthly_checklists": {
      "1": 2,
      "2": 0,
      "3": 1,
      "4": 0,
      "5": 1,
      "6": 0,
      "7": 0,
      "8": 0,
      "9": 0,
      "10": 0,
      "11": 1,
      "12": 2
    }
  },
  "species": [],
  "metadata": {
    "generated_at": "2026-03-09T23:56:21.739810Z",
    "data_version": "Dec-2025"
  }
}