{
  "hotspot": {
    "locality_id": "L56668545",
    "name": "Ford World HQ Campus",
    "coordinates": {
      "latitude": 42.2960561,
      "longitude": -83.2381857
    }
  },
  "effort": {
    "total_complete_checklists": 2,
    "total_species_detected": 0,
    "monthly_checklists": {
      "1": 2,
      "2": 0,
      "3": 0,
      "4": 0,
      "5": 0,
      "6": 0,
      "7": 0,
      "8": 0,
      "9": 0,
      "10": 0,
      "11": 0,
      "12": 0
    }
  },
  "species": [],
  "metadata": {
    "generated_at": "2026-03-23T23:26:21.271355Z",
    "data_version": "Dec-2025"
  }
}