{
  "hotspot": {
    "locality_id": "L1585935",
    "name": "Helen V. Allen Park",
    "coordinates": {
      "latitude": 42.6591999,
      "longitude": -83.0987748
    }
  },
  "effort": {
    "total_complete_checklists": 3,
    "total_species_detected": 0,
    "monthly_checklists": {
      "1": 0,
      "2": 0,
      "3": 0,
      "4": 0,
      "5": 2,
      "6": 1,
      "7": 0,
      "8": 0,
      "9": 0,
      "10": 0,
      "11": 0,
      "12": 0
    }
  },
  "species": [],
  "metadata": {
    "generated_at": "2026-03-09T23:56:21.739713Z",
    "data_version": "Dec-2025"
  }
}