{
  "hotspot": {
    "locality_id": "L16976927",
    "name": "West Road Pocket Park",
    "coordinates": {
      "latitude": 42.140521,
      "longitude": -83.17532
    }
  },
  "effort": {
    "total_complete_checklists": 3,
    "total_species_detected": 0,
    "monthly_checklists": {
      "1": 0,
      "2": 0,
      "3": 1,
      "4": 0,
      "5": 0,
      "6": 0,
      "7": 0,
      "8": 0,
      "9": 0,
      "10": 0,
      "11": 1,
      "12": 1
    }
  },
  "species": [],
  "metadata": {
    "generated_at": "2026-03-23T23:26:21.268735Z",
    "data_version": "Dec-2025"
  }
}