{
  "hotspot": {
    "locality_id": "L6473992",
    "name": "Galien Wastewater",
    "coordinates": {
      "latitude": 41.8143302,
      "longitude": -86.519807
    }
  },
  "effort": {
    "total_complete_checklists": 9,
    "total_species_detected": 0,
    "monthly_checklists": {
      "1": 1,
      "2": 0,
      "3": 3,
      "4": 1,
      "5": 0,
      "6": 0,
      "7": 0,
      "8": 0,
      "9": 0,
      "10": 0,
      "11": 1,
      "12": 3
    }
  },
  "species": [],
  "metadata": {
    "generated_at": "2026-04-06T00:42:50.649260Z",
    "data_version": "Dec-2025"
  }
}