{
  "hotspot": {
    "locality_id": "L27145309",
    "name": "Gladwin SGA--Buckeye Trailhead",
    "coordinates": {
      "latitude": 43.928433,
      "longitude": -84.473592
    }
  },
  "effort": {
    "total_complete_checklists": 4,
    "total_species_detected": 0,
    "monthly_checklists": {
      "1": 0,
      "2": 0,
      "3": 0,
      "4": 1,
      "5": 0,
      "6": 0,
      "7": 1,
      "8": 0,
      "9": 1,
      "10": 1,
      "11": 0,
      "12": 0
    }
  },
  "species": [],
  "metadata": {
    "generated_at": "2026-03-24T01:04:53.732841Z",
    "data_version": "Dec-2025"
  }
}