{
  "hotspot": {
    "locality_id": "L48562004",
    "name": "Iron Creek Nature Preserve",
    "coordinates": {
      "latitude": 42.096174,
      "longitude": -84.112293
    }
  },
  "effort": {
    "total_complete_checklists": 4,
    "total_species_detected": 0,
    "monthly_checklists": {
      "1": 0,
      "2": 0,
      "3": 0,
      "4": 0,
      "5": 0,
      "6": 0,
      "7": 0,
      "8": 0,
      "9": 0,
      "10": 1,
      "11": 3,
      "12": 0
    }
  },
  "species": [],
  "metadata": {
    "generated_at": "2026-03-07T15:12:57.870356Z",
    "data_version": "Dec-2025"
  }
}