{
  "hotspot": {
    "locality_id": "L36804253",
    "name": "Trillium Woodlands Preserve",
    "coordinates": {
      "latitude": 41.848443,
      "longitude": -86.308696
    }
  },
  "effort": {
    "total_complete_checklists": 3,
    "total_species_detected": 0,
    "monthly_checklists": {
      "1": 0,
      "2": 0,
      "3": 0,
      "4": 0,
      "5": 1,
      "6": 0,
      "7": 0,
      "8": 0,
      "9": 1,
      "10": 0,
      "11": 0,
      "12": 1
    }
  },
  "species": [],
  "metadata": {
    "generated_at": "2026-04-06T00:42:50.637697Z",
    "data_version": "Dec-2025"
  }
}