{
  "hotspot": {
    "locality_id": "L29204966",
    "name": "Ridge Cemetery/Sacred Heart Cemetery",
    "coordinates": {
      "latitude": 44.009043,
      "longitude": -84.470319
    }
  },
  "effort": {
    "total_complete_checklists": 8,
    "total_species_detected": 0,
    "monthly_checklists": {
      "1": 0,
      "2": 1,
      "3": 1,
      "4": 2,
      "5": 2,
      "6": 0,
      "7": 1,
      "8": 0,
      "9": 0,
      "10": 0,
      "11": 0,
      "12": 1
    }
  },
  "species": [],
  "metadata": {
    "generated_at": "2026-03-24T01:04:53.750268Z",
    "data_version": "Dec-2025"
  }
}