{
  "hotspot": {
    "locality_id": "L863531",
    "name": "Lakeview Ave. terminus",
    "coordinates": {
      "latitude": 42.4663038,
      "longitude": -86.2536621
    }
  },
  "effort": {
    "total_complete_checklists": 4,
    "total_species_detected": 0,
    "monthly_checklists": {
      "1": 0,
      "2": 1,
      "3": 1,
      "4": 1,
      "5": 0,
      "6": 1,
      "7": 0,
      "8": 0,
      "9": 0,
      "10": 0,
      "11": 0,
      "12": 0
    }
  },
  "species": [],
  "metadata": {
    "generated_at": "2026-04-10T00:09:54.097967Z",
    "data_version": "Dec-2025"
  }
}